{
  "$schema": "https://json-schema.org/draft/2020-12/schema",
  "$id": "https://github.com/zhanghao1903/macos-computer-use/blob/main/plugins/codex-claude-engineering-lifecycle/schemas/requirements-handoff.schema.json",
  "title": "RequirementsHandoff",
  "type": "object",
  "additionalProperties": false,
  "required": ["schemaVersion", "type", "workflowId", "messageId", "featureId", "repositoryKey", "routing", "cycle", "createdAt", "body"],
  "properties": {
    "schemaVersion": {"const": 1},
    "type": {"const": "RequirementsHandoff"},
    "workflowId": {"type": "string", "format": "uuid"},
    "messageId": {"$ref": "#/$defs/digest"},
    "featureId": {"$ref": "#/$defs/featureId"},
    "repositoryKey": {"type": "string", "pattern": "^[A-Za-z0-9_.-]+/[A-Za-z0-9_.-]+$", "maxLength": 300},
    "routing": {"$ref": "#/$defs/routing"},
    "cycle": {"const": 1},
    "createdAt": {"$ref": "#/$defs/timestamp"},
    "body": {
      "type": "object",
      "additionalProperties": false,
      "required": ["title", "branch", "requirements", "confirmation"],
      "properties": {
        "title": {"type": "string", "minLength": 1, "maxLength": 200},
        "branch": {"type": "string", "minLength": 1, "maxLength": 240},
        "requirements": {"$ref": "#/$defs/artifact"},
        "confirmation": {
          "type": "object",
          "additionalProperties": false,
          "required": ["status", "confirmedBy", "confirmedAt", "evidence"],
          "properties": {
            "status": {"const": "CONFIRMED"},
            "confirmedBy": {"type": "string", "minLength": 1, "maxLength": 200},
            "confirmedAt": {"$ref": "#/$defs/timestamp"},
            "evidence": {"type": "string", "minLength": 1, "maxLength": 300}
          }
        }
      }
    }
  },
  "$defs": {
    "digest": {"type": "string", "pattern": "^[0-9a-f]{64}$"},
    "sha": {"type": "string", "pattern": "^[0-9a-f]{40}$"},
    "featureId": {"type": "string", "pattern": "^[a-z0-9](?:[a-z0-9-]{0,62}[a-z0-9])?-[0-9a-f]{12}$", "maxLength": 76},
    "timestamp": {"type": "string", "format": "date-time", "pattern": "^\\d{4}-\\d{2}-\\d{2}T\\d{2}:\\d{2}:\\d{2}Z$"},
    "path": {"type": "string", "minLength": 1, "maxLength": 500, "pattern": "^(?!/)(?!.*(?:^|/)\\.\\.(?:/|$))(?!.*\\\\).+$"},
    "routing": {
      "type": "object",
      "additionalProperties": false,
      "required": ["sourceTaskId", "destinationTaskId"],
      "properties": {
        "sourceTaskId": {"type": "string", "minLength": 1, "maxLength": 200},
        "destinationTaskId": {"type": "string", "minLength": 1, "maxLength": 200}
      }
    },
    "artifact": {
      "type": "object",
      "additionalProperties": false,
      "required": ["path", "commitSha", "sha256"],
      "properties": {
        "path": {"$ref": "#/$defs/path"},
        "commitSha": {"$ref": "#/$defs/sha"},
        "sha256": {"$ref": "#/$defs/digest"}
      }
    }
  }
}
